{
  "artifacts": [
    {
      "path": "artifacts/autosci/runs/shim-exp-run-full-native/wiki_state_resolver.json",
      "type": "wiki_state_resolver_json"
    },
    {
      "path": "artifacts/autosci/runs/shim-exp-run-full-native/experiment_design_final_execution_boundary.json",
      "type": "experiment_design_final_execution_boundary_json"
    },
    {
      "path": "artifacts/autosci/runs/shim-exp-run-full-native/experiment_plan.json",
      "type": "solar_evidence_json"
    }
  ],
  "inputs": {
    "claim_id": "claim-001",
    "execution_mode": "human_approved",
    "idea_id": "idea-001",
    "native_options": {
      "add": "",
      "affiliation_logo": "",
      "after_artifacts": [],
      "all": false,
      "allowlist_evidence": [],
      "anonymous": false,
      "approval_ref": "",
      "authors": "",
      "auto": false,
      "auto_figures": false,
      "before_artifacts": [],
      "canvas": false,
      "checklist": false,
      "claims_evidence": [],
      "code_evidence": [],
      "collect": false,
      "collect_ready": false,
      "compile_after_artifacts": [],
      "compile_allowlist_evidence": [],
      "compile_approval_ref": "",
      "compile_before_artifacts": [],
      "compile_execute_approved": false,
      "compile_executor_timeout_seconds": 120,
      "compile_runtime_evidence": [],
      "compile_target": "",
      "conference_logo": "",
      "crystallize": false,
      "daily_categories": [],
      "daily_decisions": "",
      "daily_feed": "",
      "daily_hours": 0,
      "daily_max_auto_ingest": 0,
      "daily_max_recommendations": 0,
      "daily_mode": "",
      "daily_no_external": false,
      "daily_send_email": "",
      "depth": 0,
      "difficulty": "",
      "discover": false,
      "double_blind": false,
      "edge_types": "",
      "env": "local",
      "execute_approved": false,
      "experiment_after_artifacts": [],
      "experiment_allowlist_evidence": [],
      "experiment_approval_ref": "",
      "experiment_before_artifacts": [],
      "experiment_execute_approved": false,
      "experiment_executor_timeout_seconds": 120,
      "experiment_result_evidence": [],
      "experiment_runtime_evidence": [],
      "fix": false,
      "focus": "",
      "format": "",
      "full": true,
      "idea_approval_ref": "",
      "layout": "",
      "lifecycle_summary": [],
      "max_ideas": 0,
      "max_rounds": 0,
      "min_font_size": null,
      "model_command": "",
      "model_evidence": [],
      "no_figures": false,
      "no_introduction": false,
      "no_logos": false,
      "no_refine": false,
      "novelty_evidence": [],
      "obsidian": false,
      "online": false,
      "page_count": null,
      "page_limit": null,
      "paper_slug": "",
      "pdf_inspection": "",
      "pilot_handoff_evidence": [],
      "pilot_runtime_evidence": [],
      "pipeline": "",
      "quick": false,
      "refine_iterations": 0,
      "remote_check_command": "",
      "remote_run_dir": "",
      "render": false,
      "require_review_llm": false,
      "results_approval_ref": "",
      "review": false,
      "review_llm_command": "",
      "review_llm_endpoint": "",
      "review_llm_evidence": [],
      "review_llm_model": "",
      "review_llm_provider": "",
      "reviewer_thread_evidence": [],
      "runtime_evidence": [],
      "scheduler_demo": false,
      "scheduler_dispatch_external_evidence": false,
      "scheduler_include_blocked_external": false,
      "scheduler_include_human_gates": false,
      "scheduler_legacy_smoke_runner": false,
      "scheduler_node_id": [],
      "scheduler_require_workflow_config_alignment": false,
      "scheduler_run": false,
      "scheduler_timeout": 30.0,
      "scope": "",
      "serve": false,
      "skip_paper": false,
      "skip_pilot": false,
      "skip_validation": false,
      "source_evidence": [],
      "start_from": "",
      "stress_test": null,
      "submission_audit": "",
      "submission_mode": "",
      "submission_profile": "",
      "target_score": 0.0,
      "title": "",
      "types": "",
      "verbose": false,
      "verified_min_font_size": null,
      "verified_page_count": null,
      "visualize": false,
      "write": false
    },
    "smoke_mode": false,
    "target": "exp-skillgen"
  },
  "limitations": [
    "Approval-gated native experiment design; no command is executed by this planning action.",
    "Target `idea-001` was not found in wiki ideas, experiments, outputs, or graph edges.",
    "Resolver is read-only; it does not mutate wiki state, add graph edges, or rebuild wiki indexes.",
    "Frontmatter parsing supports scalar values and simple lists only; complex YAML is reported through missing fields.",
    "No wiki root exists for state resolution.",
    "Review LLM design validation was not supplied.",
    "Experiment design final execution readiness requires resolved target evidence, completed Review LLM validation, approval preflight, command handoff, and expected artifact handoff."
  ],
  "node_id": "node-design-experiment",
  "outputs": {
    "experiment_plan": {
      "approval_required": true,
      "baseline": "N/A",
      "baseline_absence_reason": "No native runtime has executed yet.",
      "command_allowlist": [
        "python3 plugins/autosci/bin/autosci_bridge.py run --action run_experiment",
        "python3 plugins/autosci/bin/autosci_bridge.py run --action monitor_experiment"
      ],
      "evidence_ids": [
        "exp-skillgen"
      ],
      "execution_mode": "human_approved",
      "expected_artifacts": [
        "experiment_result.json",
        "experiment_status.json",
        "experiment_run.log"
      ],
      "experiment_id": "exp-skillgen",
      "hypothesis": "A verified approved runtime will produce result artifacts without relying on surrogate outcomes.",
      "metrics": [
        "approval_present",
        "runtime_evidence_verified",
        "result_artifact_present"
      ],
      "objective": "Validate evidence coverage for `exp-skillgen` using an approval-gated native experiment.",
      "procedure": [
        "Resolve the target idea, claim, or experiment plan evidence.",
        "Require explicit approval and allowlisted runtime command evidence before execution.",
        "Collect runtime logs, metrics, and produced result artifacts.",
        "Validate experiment_result.v1 and experiment_status.v1 from supplied runtime evidence."
      ],
      "resource_limits": {
        "network": "requires_approval",
        "timeout_seconds": 0,
        "write_scope": "approved_artifact_dir_only"
      },
      "review_llm": {
        "checked_paths": [],
        "claim_id": "exp-skillgen",
        "reasons": [
          "No Review LLM evidence was supplied."
        ],
        "status": "unavailable"
      },
      "source_context": {
        "final_execution_boundary": {
          "approval_ready_for_execution": false,
          "approval_required": true,
          "approval_state": "approval_required",
          "artifact_handoff_declared": true,
          "blocking_reasons": [
            "completed Review LLM design validation is missing",
            "approved runtime preflight contract is incomplete"
          ],
          "command_allowlist": [
            "python3 plugins/autosci/bin/autosci_bridge.py run --action run_experiment",
            "python3 plugins/autosci/bin/autosci_bridge.py run --action monitor_experiment"
          ],
          "command_handoff_declared": true,
          "execution_mode": "human_approved",
          "execution_ready": false,
          "expected_artifacts": [
            "experiment_result.json",
            "experiment_status.json",
            "experiment_run.log"
          ],
          "limitations": [
            "Experiment design final execution readiness requires resolved target evidence, completed Review LLM validation, approval preflight, command handoff, and expected artifact handoff."
          ],
          "review_evidence_ids": [],
          "review_llm_completed": false,
          "review_llm_status": "unavailable",
          "schema": "autosci_experiment_design_final_execution_boundary.v1",
          "status": "execution_readiness_incomplete",
          "target_ref": "exp-skillgen",
          "target_resolved": true
        }
      },
      "success_criteria": [
        "approval_present == true",
        "runtime_evidence_verified == true",
        "result_artifact_present == true"
      ],
      "variables": [
        "execution_mode",
        "approval_contract",
        "runtime_evidence"
      ]
    }
  },
  "provenance": {
    "implementation_package": "plugins/autosci",
    "operator_id": "autosci-bridge",
    "timestamp": "2026-07-10T14:03:56Z"
  },
  "schema": "experiment_plan.v1",
  "sprint_id": "phase19-skillgen-operator-smoke",
  "status": "completed",
  "task_id": "task-autosci-skillgen-design_experiment"
}
